**Nobody makes mistakes ever,** so when they do, the relationship should end.	2
they often have much bigger buttons, text, and menus to work better for someone on a touch screen as opposed to someone on a computer.	2
You didn't exist	2
You can make arguments for something like Toy Story	1
Thats the issue.	1
I think most vegetarians see killing and eating an animal as wrong regardless of how good the conditions it lives in are.	2
Ignorance might be the cause, of course, rather than just lack of intrinsic intelligence	2
Thank you, 	0
I am curious regarding potential for more public accountability held to parents who fail to direct their child.	1
So, maybe a complex way to combine them.	0
Can you name at least one game that has spectacular change/s or uniqueness among its predecessors and genre?A few:-Elder Scrolls-GTA-Dragon Age (With Inquisition)-Metroid Prime-Mass EffectThe list goes on.	0
This implies the complement is meaningful.	1
By fortifying themselves in their gated communities with rows upon rows of automated defences, all unburdened by humans with consciences and families, they can simply wait for everyone to starve or get killed while they bask in their machine generated wealth.	2
'2.	0
because I want to know what older, more mature people think	2
Even on reddit i was originally hesitant to be open about it because of the username system would tie it to my reddit identity.	2
Should't this sort of thing be stopped ?	1
With only a couple exceptions, the vast majority of Shepard's crew are interesting, fleshed-out characters, each with their own flaws and redeeming qualities.	2
.My illustrations are ridiculous )	0
What about people who think an invisible man in the sky inpregnated a virgin 2,000 years ago with himself and can see and hear every person on earth, including their thoughts and judges whether or not you will burn for eternity even though he knows what you are going to do before you do?	2
I had the courtesy to explain what you missed and why, which did include a current inability to anticipate consequences (which is in the linked Harvard study) and how changing your view was a part of growing up and why	2
Land before Time has about 15 other movies in the franchise which make it popular, much like toy story	1
Perhaps my family (and quite a few other families) are just not equipped to play this game.	2
I find your passive aggressiveness and focus on superiority and inferiority to be low	1
[This study](http://www.ncbi.nlm.nih.gov/pubmed/20479151) shows that unprocessed meat is not linked to heart disease, but processed meat is	2
CMV: Most democracies are far too tolerant of extremism, especially the likes of neo-fascism, neo-nazism, radical Islamism and violent intolerance.	1
I don't think this decision changes if you are comfortable killing for money	1
It makes no sense.	2
I think you and I more or less agree that their is something fetid in the system	1
I suspect this way of looking at it is still somewhat simplistic however	1
I've watched stars fall on a hilltop so clear and beautiful as I called a friend a sister for the first time.	2
EDIT: [Awarded Delta](http://www.reddit.com/r/changemyview/comments/2rawgb/cmv_i_believe_that_regularly_browsing_4chan_will/cneyhn7?context=3)&gt;On boards you will find echo chambers where people are more prone to believe rumors than proof. Things about e-celebrities will start as rumors, ideas about them or things will get taken out of context and it will be posted continually until it's taken as fact. It will reach conspiracy theory levels of "proof" where people will simply believe it because they feel as if they are a part of a group-effort that's uncovering something.	0
that has to do with the degree to which the disorder is disruptive not only to the person who has the disorder, but to the general public as well	2
they're declared intelligent or not, and implicitly worthwhile or not	1
.&gt; I do agree that today's moderates are potentially tomorrow's conservatives. However this isn't about being just a bit conservative. It's about people that advocate death and destruction - terrorism, genocide, ethnic cleansing and murder.	0
[I am not the only one to predict this outcome](https://www.jacobinmag.com/2011/12/four-futures/) (see the last section on "exterminism"). I don't think the other more optimistic futures expressed in that article will come to pass given current mentalities.I think it's also too late to stop it.Those who will fight it will lose.Please CMV so I can have hope again.	0
~slaves~~ robots	1
Full disclosure I use an iPhone but any smart phone can handle this.	0
Well how can you expect young people who haven't experienced being old to make informed voting decisions regarding retirement? You could say that young people will vote in interests of creating the best retirements because they will some day retire but do you really expect people to prioritizes decades in the future over the short term?&gt; Should young adults with trust funds not be allowed to vote because they don't know what it is like to live pay check to pay check? What about terminally ill adults? They wont experience long term consequences. What about the unemployed? They don't pay income tax so they don't contribute (for the sake of argument). Can we just start taking away the voting rights of everyone who has a different political ideology than you (I assume this is what you are really getting at, "can the old people just die so we can have some progress already!?!?")?	0
With all that said and considered, is there any reason to choose another **single** form of exercise over swimming, other than lack of accessible facilities (EDIT: or physical inability to swim)?Edit 2: view changed, because 	0
that this process, if not abused, if followed by the people, and if we found an increasingly accurate measure of intelligence, would be ultimately a good thing to advance the human race.	1
One of the person present was under the protection of something called "service de protection des hautes personalités" (it has been renamed since but still same goal).	2
CMV: I believe the Brave Little Toaster is an incredibly underrated movie	1
&#8710;Thank God you make an exception for HP ;)Best comment on the thread and you get a delta for pointing out that the extended editions give non-book readers an experience that is closer to the immersion of reading the books.	0
works your legs and core quite hard	2
Consider the goal the creators of CoD have.	2
You lose your temper and get out of your brand new car yelling up a storm.	2
The difference was, 	0
Even without auctions, making sure people are aware that they can be "flexible" about collecting rent makes the game go much faster.	2
, yet for some reason 	0
Some people aren't changed by others that easily.	2
fair enough	1
After building in requirements for parents to attend a weekly P/T meeting and/or more,	2
More intelligent people tend to have less children than do the more uneducated.	2
Because that's a part of the Easter story even though it was technically a Jew being crucified on Good Friday.	2
it could also deter from suicide attacks as they usually count on not being caught alive and of course it always is best for the attacker to be brought to justice in court.	2
When most of the populace lived on farms or walked to work in a factory, most people got tan quite easily.	2
It's this aspect that attracts the people you describe,	1
The answer to both of those questions is unambiguously "yes."	1
Do I need to post an opening and go through a standard process, or can I hire my old classmate?	2
our supposedly incompetent and untrustworthy police are definitely a better job of enforcing the law than those protectors could ever have	1
many of my pets are exotic and farm animals	2
&#8710;	0
due to the gradual process that produces what we call new species and how we define them, there was never a single egg that gave rise to the first chicken.	1
I would define patriotism quite simply as supporting one's country, but not *necessarily* disparaging others.	2
at some point it does	2
, so 	0
I don't want to have relations with any of my male friends and afaik they don't expect any sex from me.	1
Money circulates multiple times in a system	1
While you may find the practice disingenuous or disgusting, this is not reason enough to hold the behavior as evidence of a specific disorder in and of itself	1
because they are trying to get americans to vote for them	2
I believe this is true for all adaptations, not just LOTR.	1
