It is also downright silly to consider	1
However, cheating on a spouse is *pretty big mistake*.	2
I lost hope often because things felt hopeless	2
In regard to your comment anonymity, 	0
Eugenics is not realistically feasible	1
There's really no reason to believe that every person has exactly the same potential to succeed well in school	2
you just picked up your brand new car from the dealer	1
Universalism	1
These people would have been raised by their incompetent parents to drain down society, increase crime rates, suck up resources, and generally screw things up	1
.CMV.	0
the above questions are more like fragments of a bigger picture of misunderstanding	1
In some cases, couples can and should choose to work through it	1
**Sex is the most important part of a relationship,** and therefore, betraying it and that agreement mean the relationship should end.	2
CMV: I think the board game "Monopoly" is poorly designed	1
Modern technology like the internet must be considered	1
The family dynamic + the individual personalities of each player changes how the game goes	2
&gt;workers will have nowhere to go but to the unemployment line.	0
And it's no harder than being a friend with a guy,	1
Slut shaming, or as you did, calling it as "whoring"?	2
There are multiple reasons for this, more intelligent people tend to be more busy with careers, etc.	2
&#8710;&gt; marriage is a commitment. If you break that commitment, the marriage is broken.This is the best argument I've heard so far.Thanks!	0
Now of course, this is a romantic view of history which takes the surviving works of outstanding people, rather than looking towards the common man...	1
I can definitely think of other bits of inefficiency but that wasn't the question so nevermind! :)	0
im 20 years old	2
&gt; As for you, fix those thought patterns and get used to it, because you're going to readjust a lot. Best to find out how to deal with information instead of trying to be "right", because sides are made by and for clergy and politicians, it wont do you any goodAhh.	0
the site however doesn't create these people it merely attracts them and for many like myself, helps them get out of that mindset in their real life.	2
Shall we rule out sociopathy/psychopathy?	2
my point there wasn't that conservatives are terrible, but that what is considered moderate and okay changes	1
A "standard" hiring method would ensure that every applicant would be evaluated on the same criteria - the satisfaction of requirements of the position and merits relevant to that position.	2
Well hopefully it wouldn't be implemented in a way that forces you to do anything except stop having children after you reached the point where any more and you'd be hurting future generation's intelligence.	2
.&gt; I did anticipate this, and I'm not doing it to troll, but I really do want to change your view--more specifically, that sort of thinking. It'll go well with you to be smarter than that.	0
Also, I don't mean to suggest that there is anything wrong with posting nudes.	1
&gt; It's good that you've distanced yourself from your view in saying you're not that confident in it. It's one step closer to abandoning it.	0
thus being legal to kill in defense	2
None.	2
, so feel free to prove me wrong.	0
I came here to learn	1
- that no one else would stand by her side, that everyone was dead and this was all she had left.	0
To be fair that's not specific to 4chan	1
At this point, it comes to down to complete and utter chance.	2
I think that's still largely an accident of geography	1
giving you the socio-political consequences of 55 million people missing might change your view	1
Ill narrow it down to religion or culture.So, 	0
The point is that responsible carnivory is better for general livestock welfare than veg*	1
It's really not that difficult with a little common sense!	2
the man tries to show the woman how non-threatening and valuable he is from a non-romantic standpoint before she is comfortable with allowing herself to think of him as a safe partner	2
others would want to see that person medicated or receiving some form of psychiatric treatment for that persons own benefit.	2
It's not a free, democratic society by any means.	1
America's problem isn't that it isn't a democracy	1
).&gt;I mean hell, it's hard enough for many people to empathize with each other, and you're asking them to try to put themselves in the hooves of a cow? It's just beyond the scope for many people unless they seriously put the time in to think about it, and they've got their own lives to worry about.	0
Holy Crap I never knew it only went straight to VHS.That does explain a lot which kinda makes me sad it never got the loving from a massive portion of people like Iron Giant.Maybe a rerelease on Netflix will reignite the fire of the Brave Little Toaster.btw Um you get a delta for proving me wrong and that the movie was loved by the people but had very little in terms of distribution &#8710;	0
It's clearly an oligarchy	1
Most people seemed to be saying "Fuck North Korea!!	0
may point to a succinct reason why they tend to receive a blanket discount in most areas of the US.	1
their nervous system is sufficiently different from us	2
CMV: The theatrical cuts of Lord of the Rings are superior to the extended cuts and should be considered the definitive versions.	1
.2) 	0
a nudes-poster should anticipate this.	0
each worker is being paid less than the price of the things they produce so that their boss can profit	2
The moderate majority of the world gets to decide the demarcations for the narrow political band around the center.	2
It's impossible to assert that everyone who has posted nudes does it strictly for attention.	2
so much of their lives revolve around getting in and out of chairs	2
"What would the likely reaction be?" is not the right question to ask.	1
Think of something you do every day that you consider perfectly reasonable; something that harms nobody in any direct sense.	2
doesn't make life have a point	1
My belief: sex is a very important part of a relationship, but not *the* most important part.	1
It's the mindset i got from 4chan that helps me and others move on from our problems, that we shouldn't drag them around to each *new thing* we do but instead move on and start over.	1
&gt; Well we have the benefit of history.	0
perhaps because of the scandalous nature of Mary's pregnancy?	2
.That said, 	0
I read it a month or so ago I'm actually referring to corn.	1
Do you do this to seek attention from her?	2
The Amish and the Vedic religions in general haven't been demonized to the same extent as Muslims have.	1
I wouldn't want to witness it	1
i.e. Alice has two Yellow properties and one Green property, while Bob has two Green properties and one Yellow property	2
Cheating is evidence that *something* must be wrong.	2
that was a lapse in emotion that revealed your age	1
I'm arguing that of the potential ways to die, being killed is the best an animal can realistically hope for	1
[I am not the only one to predict this outcome](https://www.jacobinmag.com/2011/12/four-futures/) (see the last section on "exterminism"). I don't think the other more optimistic futures expressed in that article will come to pass given current mentalities.I think it's also too late to stop it.Those who will fight it will lose.Please CMV so I can have hope again.You remember that old phrase from Forest Gump, "a man only needs so much money, the rest is just for showing off."Well that's actually quite true.	0
Then you go on to, instead of making an actual argument to prove me wrong, to say that I am not capable of holding these views without being inferior	2
Concepts like death or dying in children's features are incredibly out of favor right now.	2
* **you are a retard!** *argue about whether or not these abortions have had a benefit to the country?	2
Most people know Jesus was born on Christmas, but less realize that the wise men didn't show up until the Epiphany twelve days later	2
People are smart, printed books still exist, where the average group of city slickers could get enough knowledge to plant some crops and survive off the land.	2
Fear of losing votes from radical sympathizers leads to political groups appeasing extremism.	2
Because that would be the most unbelievable aspect of the entire story if you ask me	2
Praxagora: I want all to have a share of everything and all property to be in common; there will no longer be either rich or poor; I shall begin by making land, money, everything that is private property, common to all.Blepyrus: But who will till the soil?Praxagora: The 	0
this, you have to keep in check yourself	2
Walking	1
there would have certainly been benefits to a preemptive tactical nuclear strike against the USSR, and costs too	2
I think the vast majority of vegans and vegetarians are not delusional and feel similarly about the meat industry as I do about the Salvation Army.	1
?This is Change My View.	0
Okay	1
I just don't understand that you're of behavior and since I have never partaken in it I just can't grasp it.	1
Distinguish between decreasing and stopping, owning and responsibly owning, laws and culture...	2
It's only 60 something years old	2
I don't think it would	1
This value may not be the price being charged for the thing	2
CMV: I feel skill is largely determined by experience. Compliments on skill are almost meaningless.	1
there are complex socio-political issues involving the ones that are	1
If there are more non-asshole rich, why isn't there a global push for better worker protection, and investment, instead of the complete opposite?	2
So why would a bunch of social outcasts who get made fun of encourage hate and let such raw emotion reign supreme?	2
the Marines are a cult	1
Being the one that requires the most land usage and causes the most environmental issues as well as obviously slaughtering them.	2
it didn't solve much	1
In terms of evolution, the question is erroneous.	1
That's without even getting into the massive amounts of land used for soy and hay production for livestock.	2
if you have to make so many exceptions to your view, then it seems you already know it's incorrect	2
What all of you seem to be telling me so far is that the highest form of relationship doesn't have to be romantic	1
You truly are ridiculous	2
, then 	0
.Do you see why this reasoning breaks down because 	0
it's necessary for the health of humans and a better option than researching on humans	2
If all of this time and money goes towards a bad hire, that is an extremely bad thing for the business, which means that it's extremely important to minimize the number of bad hires.	2
Whatever way you think you can make yourself useful.	2
The finale of ME3 goes from a completely unsatisfying throughly annoying ending that ignored the themes of choice and self-determination that had been going on through the game into one final, desperate chance to make it right, instead.	2
A bad choice which breaks one of the cornerstones of marriage.	2
Isn't the characterization of Jews as "Christ-killers" rooted in antisemitism?	1
If  no harm is done, what problem is there in using the internet for such exchange?	2
Might want to change it from "you should be on the Ukranian border, driving back Russians".	0
I do not participate in most social media besides reddit, and even then I mostly lurk.Regardless, 	0
The example of my theory was best evident in my CS classes	1
&gt;The fact we have domesticated some animals also does not mean they suffer any differently to their wild cousins.On the contrary: 	0
Christianity was one of a very small number of religions that claim a duty to proselytize and convert everyone	2
children are moved through by age, graded literally on the same scale as a meat product, and bells move them around	2
I see that and agree with it	1
In order to eliminate discrepancies, the system needs to codify at least some specific instances, and by doing such for an immense number of actions we go beyond, well, *any* one person's memory.	1
Iron Giant doesn't really deal with much that's terribly dark or controversial	1
Networking is discriminatory.	1
there's an entire article I read about this once	2
I posted with the actual intent of proving that a hypothetical situation could have eugenics be good.	1
issues that are of personal relevance are always going to carry more weight.	1
Censorship is an extreme reaction to an extreme force	2
I get your point	1
the easiest way to do so is through negotiating with other players, a point that many Monopoly players fail to notice	2
It is comparable to that, too	2
All you know in all three scenarios is that someone you are in conflict with probably has a gun and there is a significant chance they will use it.	2
Players who don't like trades tend to be nervous about giving other players a better position	2
the Marines don't have their own medical services	2
explicitly notes that it only applies when livestock is fed on grass rather than grain	2
And Christ, you said you *had the courtesy to explain this to me*. Kid...	2
so 	0
One of the largest predictors for success appears to be not being poor.	1
Perhaps changing my position to "websites should not default force a user to a mobile site and instead allow a user to easily choose mobile over regular."Would better handle the situations you have described.I suppose, 	0
a.) incompetent	1
.&gt; I find your passive aggressiveness and focus on superiority and inferiority to be low.	0
.Scenario 2: 	0
once the technology exists to 3D-print a chicken breast that tastes about as good as the real thing at an affordable price with 0 animal death, I eat that instead.	2
Automation is a slow process that will take decades, and end up revolutionizing our economic structure and way of life.	1
A vegan or vegetarian diet denies demand, and thus potential revenue, to all meat-producing farms, regardless of how humane or environmentally sound their practice are.	1
?	2
I do see a distinction between a pet and livestock	1
.But 	0
A man and a woman with average IQ can have two children (not each.) and sustain their population.	2
But being an engineer, I just want to focus on the technology.	2
They are gradual and at times may seem impossible to many	2
For example, i can read , write, and even speak backwards pretty well.	2
.&gt; Therapy. I like that. So personal; very theatrical. Can I comment on your inferior reasoning and why it's inferior without it being a big deal? This is Change My View. Did you expect people to not shoot holes in your reasoning? If my reasoning is inferior, than prove the original view along with the logic behind it wrong. Its that simple .	0
Did you not even read any of this?	2
because we seem to forget so many times that women are people too, they are sad, happy, lonely and joyful at times, just like us.	2
I certainly value our free speech	1
, but then again 	0
though (is it?	0
when you balance that out with perpetual unemployment its still better then the alternative.	1
For an extreme example of this 	0
The attitude of human value as "what they [potentially] contributed to me/Exxon Mobile" is the spirit of eugenics and genocide, subjects often glorified on reddit.	1
But I also think that the welfare of food animals is part of a much larger constellation of interrelated "food production issues" that involve everything from environmental impacts to worker safety to the corporatization of agriculture to government subsidies	2
will stop responding when exposed to typical anasthetics	2
One very tense scene for me was when the vacuum cleaner was trying to cross the canyon.	2
When you say economic collapse, what precisely do you mean?Market failures?Currency issues?A recession or depression?Bottom line is that 	0
most of the answers to that on the internet before were "If you want to know more you should just read the damn books, scrub!" because nerds are like that sometimes.	2
)MERRY CHRISTMAS!	0
And 	0
you're simplifying it down to a level where it doesn't show all of the uses of the money that actually happen	1
americans are better because of the side of the line they are born on	2
you seem to have been made mad by my comment and then put anger into the rest of your response	1
This is a failing of the existing job application paradigm, not an excuse to circumvent it in order to make the process easier.	2
Hire an expensive private tutor instead.	2
I am just looking at the outcome of people following the religion.	1
"33% of women who obtain abortions have family incomes under $11,000 annually, 11% of abortions are obtained by women whose household incomes are $50,000 or more."	2
Sure, hopefully I can find some sources to support this argument as well, otherwise I may have to change my mind![http://juneauchoice.com/whohasabortions.htm](Here is a well sourced link to some stats about women who have abortions)	0
Jeez, my college is known for being the land of partying, gorgeous college people.	1
In high school, 	0
Maybe, but [now we're just haggling over the price](http://www.goodreads.com/quotes/300099-churchill-madam-would-you-sleep-with-me-for-five-million), or the number of mistakes.	0
The above assumes that the Europeans should get more involved with the Ukrainian conflict.	1
Wanting to make a profit on the dolls, the boss then sells the dolls for £10 each.	2
Does intelligence really make much of a difference when it comes to the ethics of whether we can kill them without moral concern?	2
On one hand the trend if confirmed would be consistent with Karl Marx's prediction.	1
The belief that one has an animal spirit is not new and has been a component of many primitive animistic cultures throughout history	2
)?Also, if old people can't vote than who will represent their interests?	0
The air force isn't right for me	1
Same with CoD. 	0
Since I am so unaccustomed to it and do not partake in it, I can't make an uninformed judgement about it.	2
Matthew 2:11	2
It might be true that 42% of the aborted babies would have been [below the federal poverty line]	1
It's an ethical question	2
Loyalty.	2
Listing of relgion by number of followers http://en.wikipedia.org/wiki/Major_religious_groups#Religious_demographics 1. Christianity 2. Islam 3. Hinduism 4. Buddhism 5. Shinto 6. Sikhism 7. Judaism	2
Some examples would be, when the Flower observes it's own reflection in the toaster	2
It's the same problem with war	1
Edit: but how can you have truly fair elections if things like superpacs exist?What's your basis for believing that SuperPACs make elections un-free or un-fair?	0
"	0
[finding the girl who threw a puppy in a river,](http://www.techhive.com/article/204615/Video_of_Puppies_Thrown_into_River_Spark_Outcry_and_Sleuthing.html)	2
&gt;What a douchebag line.You&#8217;ll have fun [here](http://www.reddit.com/r/changemyview/comments/2rexe3/cmv_emts_sar_firefighters_police_etc_should/cnf9wqo?context=3), then.	0
Cheating shouldn't always signify an immediate end to a relationship.	1
The Zeitgeist changes, as people's attitudes adjust to new information and ways of life and problem solving	1
If you go on 4chan right now to the /wg/ board (wallpapers) or the /vr/ board, almost everyone there is nice	2
I agree that synthetic meat would be absolutely amazing though!	1
the bible states that all animals were put on earth by God to serve man	1
once they can administrate their own systems what is the use of humans.	2
[helping some guy buy food for his dogs,](http://i.imgur.com/tKwU3.jpg)	2
but that’s [usually] the fault of their leaders and therefore not relevant to the debate.	2
But I've got too much liberal in me to give up the cause of egalitarianism for the sake of financial stability.Compelling, though, have a delta. &#8710;	0
Why do I feel like chasing after girls and getting to know them when I have so many great guy friends already who I know care about me so much more?	2
people aren't going around thanking them with discounts.	2
A "mistake" would be flirting back with the man or woman who flirts with you at a party while your spouse is away.	1
but so did a lot of moms my age, and 	0
Some might argue that soldiers do the US a disservice rather than help	2
if someone disagrees with me on that point, *they don't deserve to be shot.*	2
for a few reasons.Firstly, 	0
For example, you mentioned that you wanted to see more of the world.	2
but it's luck that is heavily influenced by the mid-game, which is decided by the players' diplomatic skill	2
So recently I've seen a lot of posts condemning Islam as a violent religion or a sexist religion.	0
From this, we can conclude that the egg came first.	2
by the time they start aiming it at you, you have a fraction of one.	2
So did they.	1
either failing to get bad people or getting good people	2
Well, you have successfully moved me from "it's probably about 80% geography" to "it's probably 40-60% geography"	1
The boss owns the factory where the workers work	2
, and/or 	0
I entirely agree that certain parts are unnecessarily complex and complicated	1
To me, that would seem more of a preference than a strength or weakness.	1
. )	0
Every exercise I can think of can be done *at a variety of speeds over a variety of distances*.	1
You'll be hard-pressed to find moon worshipers today	2
One person's terrorist is another person's freedom fighter.	2
This is the problem with X-factors and complexity	1
It doesn't make sense for people to just agree to walk away and starve to death	1
: 	0
I think there's just a limited number of things that people are capable of caring about at one time	1
equate the anonymity as some cheap way for them to be hateful under the guise of free speech,	2
.Edit the second: though I won't say my view has been reversed or anything, it has definitely been broadened.Thanks all!	0
CMV.	0
Thinking about today's news: [BBC](http://www.bbc.com/news/live/world-europe-30710777), [Wikipedia](http://en.wikipedia.org/wiki/Charlie_Hebdo_shooting)	0
Best in terms of monetary investment?	2
so I guess in that sense I can sort of understand the stance one would receive from posting nudes.	1
55 million chances to do so isn't a bad place to start.	2
I can guarantee you I was not trying to get attention from these girls, and nor was I trying to make them think of our sexual activities or remind them of sex (impossible since I didn't live near them).	1
The companies launching these ads may be trying to win in the american market, so they can sell more of their product,	2
I just immediately view them differently as one seeking attention.	1
Good point	1
She is now trying to sell £1000 worth of dolls	2
, so feel free to prove me wrong.(http://theconversation.com/ordering-the-vegetarian-meal-theres-more-animal-blood-on-your-hands-4659)	0
.Thanks for the brilliant and well thought out answer.	0
??	0
Even you've admitted you can't really articulate it you just feel this way because you *just do*. Which is no basis for a logical or reasonable way to think about the world.	2
Do you want to improve your cardiovascular health?	2
some of it is retained as capital by the owners	2
The rich are all hoarding money on the Cayman Islands and don't care about anything that keeping it for themselves and their dynasties.	1
Then there was the debate as to whether or not a larger population with less resources per person is more innovative than a smaller one	1
And the cheater is the source of the problem.	2
The only way your argument holds is if an extremely high percentage of these potential kids would have been unproductive members of society (if they were criminals, sucked up resources, drained society, etc)	1
Regardless of paragon or renegade alignment, I believe 	0
.I would question why you feel that an action's effects have to be felt in perpetuity and never cease in order to be considered "meaningful" to oneself?Because 	0
Yes and yes and sorry :/	1
CMV: The highest form of relationship between men and women doomed to be romance	1
Just as I don't necessarily understand the joy of exhibitionism, exhibitionists don't understand how I *don't* find joy from it.	2
if I were to put someone's spouse and someone's absolute best friend in front of a train and gave that person one to save, whom would they save?	2
.Change my view.PS: I am not here to talk about USA and its gun problems.EDIT: Awarded a delta to a comment which didn't refute this idea but led me to change my view that it would be best realized with paralyzing weapons rather then guns: http://www.reddit.com/r/changemyview/comments/2rnr30/cmv_i_think_the_paris_shooting_makes_a_good_case/cni3o83I guess I look at it this way- 	0
other than anecdotal evidence, I haven't seen anything to support this claim.	2
waste has to be produced in order for the system to function	1
if someone is generally in a better state identifying as an otherkin, then there would be no real need to treat them, unless they started disrupting the lives of others.	1
I think it's counterproductive, antagonizing and in poor taste.	2
Sorry but I think this is a strawman argument.It's good to know that this view doesn't make up the majority of vegans.The vegans who believe the way I've described and who made up a good chunk of the vegans I've encountered, were a large part of my inspiration to write this CMV.	0
as policemen are a very homogeneous group trained to stick together and the danger of even deepening the "not one of us" (pack) mentality and escalation of "police state"	2
There have been a great many "dark" animated movies and shows that grew to become extremely famous.	1
Best regimen just depends on your goals	1
?-(choppy writing, but i'm on 3 hours of sleep and stretched for time, give me a break)-(Side thought: 	0
North Korea hacked Sony because they are so paranoid and insecure that they can't stand their leader being mocked.	2
I concede that this is probably good for animal welfare.	1
there's a more fundamental *reason* that poor parents are poorer at helping their children	1
I don't hear "you're so good at biology"	2
